<?xml version="1.0" encoding="UTF-8"?>

<!--
 ! @(#)libmex.xml    generated by: makefcntable 4.1   Sun Apr 11 02:58:23 2004
 -->

<FcnRegistry xmlns="urn:mathworks.dispatcher.registry"
             xmlns:xsi="http://www.w3.org/2001/XMLSchema-instance"
             xsi:schemaLocation="urn:mathworks.dispatcher.registry
FunctionRegistry.xsd"
             modname="libmex"
             checksum="0xcf6a4ccd"
             creation_time="0x4078ec8f"
             >

<FcnRegistration
          name = ""
          extension = "mexglx"
          precedence = "0xb000"
          target = "glnx86"
 />

<FcnRegistration
          name = ""
          extension = "mexi64"
          precedence = "0xb000"
          target = "glnxi64"
 />

<FcnRegistration
          name = ""
          extension = "mexa64"
          precedence = "0xb000"
          target = "glnxa64"
 />

<FcnRegistration
          name = ""
          extension = "mexhpux"
          precedence = "0xb001"
          target = "hpux"
 />

<FcnRegistration
          name = ""
          extension = "mexhp7"
          precedence = "0xb000"
          target = "hpux"
 />

<FcnRegistration
          name = ""
          extension = "mexmac"
          precedence = "0xb000"
          target = "mac"
 />

<FcnRegistration
          name = ""
          extension = "mexsol"
          precedence = "0xb000"
          target = "sol2"
 />

<FcnRegistration
          name = ""
          extension = "dll"
          precedence = "0xb001"
          target = "win32"
 />

<FcnRegistration
          name = ""
          extension = "mex"
          precedence = "0xb000"
          target = "win32"
 />

<FcnRegistration
          name = ""
          extension = "mexw64"
          precedence = "0xb000"
          target = "win64"
 />

</FcnRegistry>
