<?xml version="1.0" encoding="UTF-8"?>

<!--
 ! @(#)jmi.xml    generated by: makefcntable 4.1   Fri Apr 30 01:24:03 2004
 -->

<FcnRegistry xmlns="urn:mathworks.dispatcher.registry"
             xmlns:xsi="http://www.w3.org/2001/XMLSchema-instance"
             xsi:schemaLocation="urn:mathworks.dispatcher.registry
FunctionRegistry.xsd"
             modname="jmi"
             checksum="0x27de456c"
             creation_time="0x4091e2f3"
             >

<FcnRegistration
          name = "isjava"
          type = ":all:"
          Mvalue = "false"
          toolbox_location = "matlab/datatypes"
 />

<FcnRegistration
          name = "javaObject"
          type = ":all:"
          Mvalue = "false"
          toolbox_location = "matlab/datatypes"
 />

<FcnRegistration
          name = "java_object"
          type = ":all:"
          Mvalue = "false"
 />

<FcnRegistration
          name = "javaMethod"
          type = ":all:"
          Mvalue = "false"
          toolbox_location = "matlab/datatypes"
 />

<FcnRegistration
          name = "java_method"
          type = ":all:"
          Mvalue = "false"
 />

<FcnRegistration
          name = "javaArray"
          type = "char"
          Mvalue = "false"
          toolbox_location = "matlab/datatypes"
 />

<FcnRegistration
          name = "java_array"
          type = "char"
          Mvalue = "false"
 />

</FcnRegistry>
